<?xml version="1.0" encoding="UTF-8"?>
<catalogo_prodotti xmlns:xsi="http://www.w3.org/2001/XMLSchema-instance" xsi:noNamespaceSchemaLocation="catalogo_prodotti.xsd">
  <prodotto>
    <id_prodotto>1</id_prodotto>
    <nome>Samsung Crystal UHD 50</nome>
    <descrizione>Smart TV dal design moderno, ideale per la visione di contenuti in alta definizione e per l’intrattenimento domestico quotidiano.</descrizione>
    <prezzo>500.00</prezzo>
    <tipologia>tv</tipologia>
    <immagine>../img/tv_samsung_crystal_50.png</immagine>
    <sconti_bonus>
      <sconto_generico attivo="1">10</sconto_generico>
      <sconto_personalizzato attivo="1">
        <percentuale>10</percentuale>
        <criterio tipo="reputazione">
          <soglia>5</soglia>
          <data_riferimento/>
        </criterio>
      </sconto_personalizzato>
      <bonus_generico attivo="1">5</bonus_generico>
      <bonus_personalizzato attivo="1">
        <crediti>4</crediti>
        <criterio tipo="mesi_registrato">
          <soglia>9</soglia>
          <data_riferimento/>
        </criterio>
      </bonus_personalizzato>
    </sconti_bonus>
    <domande>
      <domanda id_prodotto="1" id_utente="4" segnalato="0">
        <autore>paoloverdi@gmail.com</autore>
        <testo>Questa TV è adatta per Netflix e YouTube?</testo>
        <id_domanda>69b99b668a293</id_domanda>
        <data>2026-03-17</data>
        <ora>19:20:22</ora>
        <utilita>
          <valore id_utente="5" reputazione_Vot="4">1</valore>
        </utilita>
        <supporto>
          <valore id_utente="5" reputazione_Vot="4">2</valore>
        </supporto>
        <risposte>
          <risposta id_prodotto="1" id_utente="5" segnalato="0">
            <id_risposta>69b99bed727c0</id_risposta>
            <id_domanda>69b99b668a293</id_domanda>
            <autore>giulianeri@gmail.com</autore>
            <data>2026-03-17</data>
            <ora>19:22:37</ora>
            <testo>Sì, la TV supporta le principali app di streaming come Netflix e YouTube.</testo>
            <utilita>
              <valore id_utente="4" reputazione_Vot="1">1</valore>
              <valore id_utente="2" reputazione_Vot="11">2</valore>
            </utilita>
            <supporto>
              <valore id_utente="4" reputazione_Vot="1">2</valore>
              <valore id_utente="2" reputazione_Vot="11">2</valore>
            </supporto>
          </risposta>
          <risposta id_prodotto="1" id_utente="3" segnalato="0">
            <id_risposta>69b9a5cdee524</id_risposta>
            <id_domanda>69b99b668a293</id_domanda>
            <autore>mariorossi@gmail.com</autore>
            <data>2026-03-17</data>
            <ora>20:04:45</ora>
            <testo>Si è perfetta per questo. Inoltre è dotata di Wi-Fi integrato per una connessione veloce e stabile.</testo>
            <utilita>
              <valore id_utente="4" reputazione_Vot="1">3</valore>
              <valore id_utente="5" reputazione_Vot="4">2</valore>
              <valore id_utente="2" reputazione_Vot="11">3</valore>
            </utilita>
            <supporto>
              <valore id_utente="4" reputazione_Vot="1">2</valore>
              <valore id_utente="5" reputazione_Vot="4">2</valore>
              <valore id_utente="2" reputazione_Vot="11">3</valore>
            </supporto>
          </risposta>
        </risposte>
      </domanda>
      <domanda id_prodotto="1" id_utente="6" segnalato="0">
        <autore>luca@gmail.com</autore>
        <testo>La qualità dell’immagine è buona anche di notte?</testo>
        <id_domanda>69b9a297acc10</id_domanda>
        <data>2026-03-17</data>
        <ora>19:51:03</ora>
        <utilita/>
        <supporto/>
        <risposte>
          <risposta id_prodotto="1" id_utente="3" segnalato="0">
            <id_risposta>69b9a2f146551</id_risposta>
            <id_domanda>69b9a297acc10</id_domanda>
            <autore>mariorossi@gmail.com</autore>
            <data>2026-03-17</data>
            <ora>19:52:33</ora>
            <testo>Offre una buona qualità d’immagine anche in ambienti poco illuminati.</testo>
            <utilita>
              <valore id_utente="6" reputazione_Vot="3">2</valore>
            </utilita>
            <supporto>
              <valore id_utente="6" reputazione_Vot="3">2</valore>
            </supporto>
          </risposta>
        </risposte>
      </domanda>
    </domande>
    <recensioni>
      <recensione id_prodotto="1" id_utente="4" segnalato="0">
        <autore>paoloverdi@gmail.com</autore>
        <testo>Qualità dell’immagine davvero ottima, facile da configurare. Consigliata!</testo>
        <data>2026-03-17</data>
        <ora>21:02:49</ora>
        <id_recensione>69b9b369e653c</id_recensione>
        <utilita>
          <valore id_utente="5" reputazione_Vot="4">2</valore>
        </utilita>
        <supporto>
          <valore id_utente="5" reputazione_Vot="4">2</valore>
        </supporto>
      </recensione>
    </recensioni>
  </prodotto>
  <prodotto>
    <id_prodotto>2</id_prodotto>
    <nome>LG Smart TV LED 55</nome>
    <descrizione>Televisore LED con funzionalità smart integrate, pensato per offrire un’esperienza visiva immersiva e un’interfaccia semplice da usare.</descrizione>
    <prezzo>579.50</prezzo>
    <tipologia>tv</tipologia>
    <immagine>../img/tv_lg_55_smart.png</immagine>
    <sconti_bonus>
      <sconto_generico attivo="0">0</sconto_generico>
      <sconto_personalizzato attivo="0">
        <percentuale>0</percentuale>
        <criterio tipo="nessuno">
          <soglia>0</soglia>
          <data_riferimento/>
        </criterio>
      </sconto_personalizzato>
      <bonus_generico attivo="0">0</bonus_generico>
      <bonus_personalizzato attivo="0">
        <crediti>0</crediti>
        <criterio tipo="nessuno">
          <soglia>0</soglia>
          <data_riferimento/>
        </criterio>
      </bonus_personalizzato>
    </sconti_bonus>
    <domande>
      <domanda id_prodotto="2" id_utente="6" segnalato="1">
        <autore>luca@gmail.com</autore>
        <testo>Perché dovrei comprare da voi e non da un negozio serio?</testo>
        <id_domanda>69bc32adc64b9</id_domanda>
        <data>2026-03-19</data>
        <ora>18:30:21</ora>
        <utilita>
          <valore id_utente="4" reputazione_Vot="1">1</valore>
          <valore id_utente="5" reputazione_Vot="4">1</valore>
        </utilita>
        <supporto>
          <valore id_utente="4" reputazione_Vot="1">1</valore>
          <valore id_utente="5" reputazione_Vot="4">1</valore>
        </supporto>
        <risposte/>
      </domanda>
      <domanda id_prodotto="2" id_utente="4" segnalato="0">
        <autore>paoloverdi@gmail.com</autore>
        <testo>La TV ha un buon rapporto qualità-prezzo?
Se si fatemi sapere perché sono molto interessato all'acquisto di questa tv.

Grazie e cordiali saluti.</testo>
        <id_domanda>69c80b39703c8</id_domanda>
        <data>2026-03-28</data>
        <ora>18:09:13</ora>
        <utilita>
          <valore id_utente="5" reputazione_Vot="4">2</valore>
          <valore id_utente="2" reputazione_Vot="11">2</valore>
        </utilita>
        <supporto>
          <valore id_utente="5" reputazione_Vot="4">1</valore>
          <valore id_utente="2" reputazione_Vot="11">1</valore>
        </supporto>
        <risposte>
          <risposta id_prodotto="2" id_utente="5" segnalato="0">
            <id_risposta>69c80f8fcae6e</id_risposta>
            <id_domanda>69c80b39703c8</id_domanda>
            <autore>giulianeri@gmail.com</autore>
            <data>2026-03-28</data>
            <ora>18:27:43</ora>
            <testo>Si ha un buon rapporto qualità prezzo.
Inoltre è davvero un piacere aiutarti.


Evviva le tv. Cordiali saluti
</testo>
            <utilita>
              <valore id_utente="4" reputazione_Vot="1">2</valore>
              <valore id_utente="2" reputazione_Vot="11">3</valore>
            </utilita>
            <supporto>
              <valore id_utente="4" reputazione_Vot="1">2</valore>
              <valore id_utente="2" reputazione_Vot="11">2</valore>
            </supporto>
          </risposta>
        </risposte>
      </domanda>
    </domande>
    <recensioni/>
  </prodotto>
  <prodotto>
    <id_prodotto>3</id_prodotto>
    <nome>Sony Bravia LED 43</nome>
    <descrizione>TV compatta ed elegante, adatta a qualsiasi ambiente domestico, con immagini nitide e colori realistici.</descrizione>
    <prezzo>429.00</prezzo>
    <tipologia>tv</tipologia>
    <immagine>../img/tv_sony_43_bravia.png</immagine>
    <sconti_bonus>
      <sconto_generico attivo="0">0</sconto_generico>
      <sconto_personalizzato attivo="0">
        <percentuale>0</percentuale>
        <criterio tipo="nessuno">
          <soglia>0</soglia>
          <data_riferimento/>
        </criterio>
      </sconto_personalizzato>
      <bonus_generico attivo="0">0</bonus_generico>
      <bonus_personalizzato attivo="0">
        <crediti>0</crediti>
        <criterio tipo="nessuno">
          <soglia>0</soglia>
          <data_riferimento/>
        </criterio>
      </bonus_personalizzato>
    </sconti_bonus>
    <domande/>
    <recensioni/>
  </prodotto>
  <prodotto>
    <id_prodotto>4</id_prodotto>
    <nome>Sony Soundbar HT-S100F</nome>
    <descrizione>Soundbar compatta progettata per migliorare l’audio del televisore e garantire un suono più chiaro e coinvolgente.</descrizione>
    <prezzo>129.25</prezzo>
    <tipologia>soundbar</tipologia>
    <immagine>../img/soundbar_sony_hts100f.png</immagine>
    <sconti_bonus>
      <sconto_generico attivo="1">5</sconto_generico>
      <sconto_personalizzato attivo="1">
        <percentuale>5</percentuale>
        <criterio tipo="crediti_totali">
          <soglia>450</soglia>
          <data_riferimento/>
        </criterio>
      </sconto_personalizzato>
      <bonus_generico attivo="0">0</bonus_generico>
      <bonus_personalizzato attivo="1">
        <crediti>5</crediti>
        <criterio tipo="crediti_da_data">